{
  "schema_version": "0.1",
  "generated_at": "2026-06-01T07:20:54.092658Z",
  "source_artifacts": {
    "render_capture_files": [
      "/Users/kangmin/Documents/excel-workbook-editing/review-packages/workbook-understanding/mbp-2026-02-render-captures.json",
      "/Users/kangmin/Documents/excel-workbook-editing/review-packages/workbook-understanding/mbp-2026-02-recapture-candidate-captures.json"
    ],
    "capture_quality_files": [
      "/Users/kangmin/Documents/excel-workbook-editing/review-packages/workbook-understanding/mbp-2026-02-capture-quality.json",
      "/Users/kangmin/Documents/excel-workbook-editing/review-packages/workbook-understanding/mbp-2026-02-recapture-candidate-quality.json"
    ],
    "view_state_profile": "/Users/kangmin/Documents/excel-workbook-editing/review-packages/workbook-understanding/mbp-2026-02-view-state-profile.json"
  },
  "method": {
    "name": "deterministic_capture_range_coordinate_normalization",
    "authority": "range_to_capture_bbox_mapping_not_visual_feature_truth",
    "visible_state_policy": "Normalize only the captured visible-state range. Hidden or filtered rows remain structural data evidence, not visual absence."
  },
  "coordinate_mappings": [
    {
      "id": "coord_quality_capture_target_결제_수수료_cell_region_1",
      "type": "coordinate_mapping",
      "status": "normalized_visible_range",
      "capture_id": "capture_target_결제_수수료_cell_region_1",
      "target_id": "target_결제_수수료_cell_region_1",
      "sheet": "결제&수수료",
      "cell_range": "A1:D13",
      "range_bounds": {
        "min_row": 1,
        "min_column": 1,
        "max_row": 13,
        "max_column": 4
      },
      "capture_bbox": {
        "x": 0,
        "y": 0,
        "width": 341,
        "height": 222
      },
      "pixel_scale": {
        "row_count": 13,
        "column_count": 4,
        "pixels_per_row_estimate": 17.076923,
        "pixels_per_column_estimate": 85.25,
        "axis_model": "uniform_range_estimate"
      },
      "quality_status": "usable",
      "view_state_classification": "no_material_view_state_signal",
      "view_state_authority_decision": "continue_with_visible_render_authority",
      "render_capture_file": "mbp-2026-02-render-captures.json",
      "capture_quality_file": "mbp-2026-02-capture-quality.json",
      "normalization_notes": "Capture range is normalized as a visible-state bbox estimate.",
      "evidence_refs": [
        "quality_capture_target_결제_수수료_cell_region_1",
        "capture_target_결제_수수료_cell_region_1",
        "view_state_quality_capture_target_결제_수수료_cell_region_1"
      ]
    },
    {
      "id": "coord_quality_capture_target_결제상세_cell_region_1",
      "type": "coordinate_mapping",
      "status": "review_required",
      "capture_id": "capture_target_결제상세_cell_region_1",
      "target_id": "target_결제상세_cell_region_1",
      "sheet": "결제상세",
      "cell_range": "A1:AY22",
      "range_bounds": {
        "min_row": 1,
        "min_column": 1,
        "max_row": 22,
        "max_column": 51
      },
      "capture_bbox": {
        "x": 0,
        "y": 0,
        "width": 3478,
        "height": 375
      },
      "pixel_scale": {
        "row_count": 22,
        "column_count": 51,
        "pixels_per_row_estimate": 17.045455,
        "pixels_per_column_estimate": 68.196078,
        "axis_model": "uniform_range_estimate"
      },
      "quality_status": "review_required",
      "view_state_classification": "no_material_view_state_signal",
      "view_state_authority_decision": "continue_with_visible_render_authority",
      "render_capture_file": "mbp-2026-02-render-captures.json",
      "capture_quality_file": "mbp-2026-02-capture-quality.json",
      "normalization_notes": "Capture has a bbox but quality checks require review before downstream visual gates trust it.",
      "evidence_refs": [
        "quality_capture_target_결제상세_cell_region_1",
        "capture_target_결제상세_cell_region_1",
        "view_state_quality_capture_target_결제상세_cell_region_1"
      ]
    },
    {
      "id": "coord_quality_capture_target_당월산식_cell_region_1",
      "type": "coordinate_mapping",
      "status": "blocked_by_view_state",
      "capture_id": "capture_target_당월산식_cell_region_1",
      "target_id": "target_당월산식_cell_region_1",
      "sheet": "당월산식",
      "cell_range": "A1:BA22",
      "range_bounds": {
        "min_row": 1,
        "min_column": 1,
        "max_row": 22,
        "max_column": 53
      },
      "capture_bbox": {
        "x": 0,
        "y": 0,
        "width": 2311,
        "height": 69
      },
      "pixel_scale": {
        "row_count": 22,
        "column_count": 53,
        "pixels_per_row_estimate": 3.136364,
        "pixels_per_column_estimate": 43.603774,
        "axis_model": "uniform_range_estimate"
      },
      "quality_status": "recapture_required",
      "view_state_classification": "filtered_or_hidden_rows_explain_capture_failure",
      "view_state_authority_decision": "separate_visible_render_authority_from_structural_data_authority",
      "render_capture_file": "mbp-2026-02-render-captures.json",
      "capture_quality_file": "mbp-2026-02-capture-quality.json",
      "normalization_notes": "Visible-state capture is dominated by hidden or filtered rows; preserve structural data separately and use only diagnostic reveal captures if needed.",
      "evidence_refs": [
        "quality_capture_target_당월산식_cell_region_1",
        "capture_target_당월산식_cell_region_1",
        "view_state_quality_capture_target_당월산식_cell_region_1"
      ]
    },
    {
      "id": "coord_quality_capture_target_리스픽_cell_region_2",
      "type": "coordinate_mapping",
      "status": "normalized_visible_range",
      "capture_id": "capture_target_리스픽_cell_region_2",
      "target_id": "target_리스픽_cell_region_2",
      "sheet": "리스픽",
      "cell_range": "A2:N15",
      "range_bounds": {
        "min_row": 2,
        "min_column": 1,
        "max_row": 15,
        "max_column": 14
      },
      "capture_bbox": {
        "x": 0,
        "y": 0,
        "width": 873,
        "height": 239
      },
      "pixel_scale": {
        "row_count": 14,
        "column_count": 14,
        "pixels_per_row_estimate": 17.071429,
        "pixels_per_column_estimate": 62.357143,
        "axis_model": "uniform_range_estimate"
      },
      "quality_status": "usable",
      "view_state_classification": "no_material_view_state_signal",
      "view_state_authority_decision": "continue_with_visible_render_authority",
      "render_capture_file": "mbp-2026-02-render-captures.json",
      "capture_quality_file": "mbp-2026-02-capture-quality.json",
      "normalization_notes": "Capture range is normalized as a visible-state bbox estimate.",
      "evidence_refs": [
        "quality_capture_target_리스픽_cell_region_2",
        "capture_target_리스픽_cell_region_2",
        "view_state_quality_capture_target_리스픽_cell_region_2"
      ]
    },
    {
      "id": "coord_quality_capture_target_매출_cell_region_1",
      "type": "coordinate_mapping",
      "status": "normalized_visible_range",
      "capture_id": "capture_target_매출_cell_region_1",
      "target_id": "target_매출_cell_region_1",
      "sheet": "매출",
      "cell_range": "A1:M60",
      "range_bounds": {
        "min_row": 1,
        "min_column": 1,
        "max_row": 60,
        "max_column": 13
      },
      "capture_bbox": {
        "x": 0,
        "y": 0,
        "width": 1278,
        "height": 1023
      },
      "pixel_scale": {
        "row_count": 60,
        "column_count": 13,
        "pixels_per_row_estimate": 17.05,
        "pixels_per_column_estimate": 98.307692,
        "axis_model": "uniform_range_estimate"
      },
      "quality_status": "usable",
      "view_state_classification": "no_material_view_state_signal",
      "view_state_authority_decision": "continue_with_visible_render_authority",
      "render_capture_file": "mbp-2026-02-render-captures.json",
      "capture_quality_file": "mbp-2026-02-capture-quality.json",
      "normalization_notes": "Capture range is normalized as a visible-state bbox estimate.",
      "evidence_refs": [
        "quality_capture_target_매출_cell_region_1",
        "capture_target_매출_cell_region_1",
        "view_state_quality_capture_target_매출_cell_region_1"
      ]
    },
    {
      "id": "coord_quality_capture_target_수익인식60일_cell_region_1",
      "type": "coordinate_mapping",
      "status": "normalized_with_view_state_warning",
      "capture_id": "capture_target_수익인식60일_cell_region_1",
      "target_id": "target_수익인식60일_cell_region_1",
      "sheet": "수익인식60일",
      "cell_range": "A1:AC22",
      "range_bounds": {
        "min_row": 1,
        "min_column": 1,
        "max_row": 22,
        "max_column": 29
      },
      "capture_bbox": {
        "x": 0,
        "y": 0,
        "width": 1858,
        "height": 358
      },
      "pixel_scale": {
        "row_count": 22,
        "column_count": 29,
        "pixels_per_row_estimate": 16.272727,
        "pixels_per_column_estimate": 64.068966,
        "axis_model": "uniform_range_estimate"
      },
      "quality_status": "usable",
      "view_state_classification": "filtered_rows_affect_capture_window",
      "view_state_authority_decision": "separate_visible_render_authority_from_structural_data_authority",
      "render_capture_file": "mbp-2026-02-render-captures.json",
      "capture_quality_file": "mbp-2026-02-capture-quality.json",
      "normalization_notes": "Capture is usable but view-state affects part of the mapped range.",
      "evidence_refs": [
        "quality_capture_target_수익인식60일_cell_region_1",
        "capture_target_수익인식60일_cell_region_1",
        "view_state_quality_capture_target_수익인식60일_cell_region_1"
      ]
    },
    {
      "id": "coord_quality_capture_target_수익인식60일_강사료_cell_region_1",
      "type": "coordinate_mapping",
      "status": "normalized_visible_range",
      "capture_id": "capture_target_수익인식60일_강사료_cell_region_1",